identifiant,nom,image,description
1,"Space Mountain",https://www.businessmarches.com/wp-content/uploads/2017/04/1.jpg,"Un voyage interstellaire qui ravira petits et grands"
2,"Pirate des Caraïbes",https://cdn1.parksmedia.wdprapps.disney.com/media/blog/wp-content/uploads/2017/06/POTCDLP1280.jpg,"Vous serez plongés dans l'univers époustouflant de vos films préférés."
3,"Splash Mountain",https://cdn1.parksmedia.wdprapps.disney.com/media/blog/wp-content/uploads/2019/07/inmbcvfxdrsewFI.jpg,"Une attraction rafraichissante qui vous aidera à vaincre la chaleur de l'été."
4,"Haunted Mansion",https://cdn1.parksmedia.wdprapps.disney.com/resize/mwImage/1/1600/900/75/dam/disneyland/attractions/haunted-mansion/hanted-mansion-exterior-16x9.jpg?1699631836595,"Une balade fantomatique à travers une maison hantée qui vous fera trembler de peur."
5,"It's a Small World",https://offloadmedia.feverup.com/parissecret.com/wp-content/uploads/2023/01/16121506/KV-its-a-small-world-1024x684.jpg,"Une croisière paisible à travers des scènes animées qui ravira petits et grands."
6,"Revenge of the Mummy",https://s7d2.scene7.com/is/image/TWCNews/n13_universal_orlando_revenge_of_the_mummy,"Montagne russes dans le noir inspirées par le film La Momie."
7,"Harry Potter and the Forbidden Journey",https://ca-times.brightspotcdn.com/dims4/default/89948c6/2147483647/strip/true/crop/2048x1361+0+0/resize/1200x797!/quality/75/?url=https%3A%2F%2Fcalifornia-times-brightspot.s3.amazonaws.com%2F28%2Ff7%2F3024e62265a8a32fa6f6afed2e90%2Fla-2455228-et-wizardingworldreview-05-jpg-20160406,"Une simulation volante à travers Poudlar qui vous fera vous sentir comme un vrai sorcier."
8,"Expedition Everest",https://www.disneyfoodblog.com/wp-content/uploads/2023/05/2023-wdw-dak-ride-expedition-everest.jpg,"Des montagnes russes à travers l'Himalaya qui vous feront peut être rencontrer le Yeti."
9,"Millennium Falcon : Smuggles Run",https://fr.web.img6.acsta.net/r_654_368/newsv7/19/02/28/11/45/1854358.jpg,"Prenez part à la guerre intergalactique contre l'Empire a bord du Faucon Millennium !"
10,"Auto Tamponneuse",https://maville.com/photosmvi/2019/10/05/P21282026D3859749G.jpg,"Certains vous disent que vous conduisez mal? Ici, tout est permi ! Emboutissez vos adversaires !"
11,"Grande Galère",https://www.parcasterix.fr/sites/default/files/styles/attraction_slider_bloc/public/images/attractions/la%20gal%C3%A8re_0.jpg.webp?itok=lr_1yA5j,"Une attraction qui vous permettra de vous immerger dans la vie d'un pendule."
65eade7dd93cb,111,https://th.bing.com/th/id/OIP.Kx5UfK_bddEXfkgPgv2c2gHaLP?rs=1&pid=ImgDetMain,1111111
65eade92c35af,3333,https://yt3.ggpht.com/ytc/AKedOLTpDkdJtimag1mOlbemycHTEO8ecFFhD_FGsflT0w=s900-c-k-c0x00ffffff-no-rj,333333333
65eadeb6d5ecc,4444,https://www.pokepedia.fr/images/8/83/Nymphali-XY.png,44444444
65eae6037248e,"Pirate des Caraïbes",https://cdn1.parksmedia.wdprapps.disney.com/media/blog/wp-content/uploads/2017/06/POTCDLP1280.jpg,dlqsdlkqnsdlnqsbldbqlsd
